[
  {
    "icon": "🔌",
    "value": "OpenAI",
    "label": "Compatible API",
    "accent": "var(--color-primary)"
  },
  {
    "icon": "💻",
    "value": "macOS · Linux · Windows",
    "label": "Operator platforms, one Bridge",
    "accent": "var(--color-warning)"
  },
  {
    "icon": "🧩",
    "value": "7 runtimes",
    "label": "Ollama · LM Studio · llama.cpp · vLLM · SGLang · Xyntetik Runner · Paddock",
    "accent": "var(--color-tertiary)"
  },
  {
    "icon": "💶",
    "value": "0%",
    "label": "Platform fee during launch",
    "accent": "var(--color-accent)"
  }
]
